{
  "object_type": "KnowledgeWalkthroughPlan",
  "walkthrough_id": "kw_fixture_001",
  "title": "Lecture Knowledge Walkthrough",
  "target_group_key": "generic_current",
  "lecture_order": ["lecture_1"],
  "student_visible_structure": [
    "lecture_title",
    "lecture_overview",
    "module_map",
    "module_title",
    "module_overview",
    "knowledge_walkthrough",
    "key_logic",
    "common_confusions",
    "must_master",
    "lecture_recap"
  ],
  "forbidden_student_fields": [
    "source_anchor",
    "confidence",
    "evidence_score",
    "recurrence_count",
    "examiner_operation",
    "discriminator_axis",
    "essay_plan",
    "practice_question",
    "answer_key"
  ],
  "lectures": [
    {
      "lecture_id": "lecture_1",
      "lecture_title": "Generic Metabolic Integration",
      "lecture_overview": "This lecture explains how a pathway is controlled by substrate supply, energy state, and tissue context. The main idea is that cells do not run pathways as isolated lists of enzymes; they coordinate intake, storage, mobilisation, and disposal according to physiological demand.",
      "core_logic": "substrate supply -> regulatory checkpoint -> pathway flux -> tissue-level consequence",
      "module_map": [
        {
          "module_id": "module_1_1",
          "module_title": "Pathway purpose",
          "one_sentence": "Explains why the pathway exists and what problem it solves."
        },
        {
          "module_id": "module_1_2",
          "module_title": "Regulatory checkpoint",
          "one_sentence": "Explains how the pathway is switched up or down."
        }
      ],
      "modules": [
        {
          "object_type": "LectureModule",
          "module_id": "module_1_1",
          "module_title": "Pathway purpose",
          "module_overview": "This module establishes the biological problem solved by the pathway. The important point is not to memorise every intermediate first, but to understand the input, the useful output, and why the output matters.",
          "knowledge_walkthrough": "A pathway should be read as a controlled conversion of **input molecules** into a useful **metabolic output**. The pathway becomes meaningful when it is linked to the condition in which it runs, such as feeding, fasting, stress, or high energy demand.",
          "key_logic": "input molecule -> controlled conversion -> useful output -> physiological role",
          "common_confusions": [
            "Do not treat pathway names as isolated facts; connect each pathway to the condition that activates it."
          ],
          "must_master": [
            "**Input** and **output** define the pathway's purpose.",
            "Regulation decides whether the pathway is actually active.",
            "Physiological context explains why the pathway matters."
          ],
          "source_anchors": ["fixture_lecture_1"],
          "student_visible": true
        },
        {
          "object_type": "LectureModule",
          "module_id": "module_1_2",
          "module_title": "Regulatory checkpoint",
          "module_overview": "This module explains why one regulated step often controls the whole pathway. A checkpoint is important because changing its activity changes downstream flux.",
          "knowledge_walkthrough": "A regulatory checkpoint usually sits near the committed or rate-limiting step. Signals such as **ATP**, **AMP**, **insulin**, or **glucagon** change enzyme activity so that pathway flux matches the cell's energy state.",
          "key_logic": "signal -> checkpoint enzyme -> flux change -> metabolic outcome",
          "common_confusions": [
            "A pathway enzyme can be present but inactive if the regulatory signal is wrong."
          ],
          "must_master": [
            "**Checkpoint enzymes** control flux.",
            "**Hormonal signals** connect pathway activity to whole-body state.",
            "**Energy charge** connects pathway activity to cellular demand."
          ],
          "source_anchors": ["fixture_lecture_1"],
          "student_visible": true
        }
      ],
      "lecture_recap": [
        "A pathway should be understood by its input, output, control point, and physiological use.",
        "Regulatory checkpoints explain why pathway activity changes between conditions.",
        "Hormonal and energy-state signals connect molecular mechanisms to whole-body metabolism.",
        "The most useful revision approach is to explain the pathway as a mechanism chain, not as a list."
      ]
    }
  ],
  "qa_status": "pass"
}
